CREATE EXTENSION "pg-audit-json";
SET client_min_messages TO WARNING;
CREATE TABLE foo (
  id BIGSERIAL PRIMARY KEY,
  a INTEGER,
  b INTEGER,
  c INTEGER
);
SELECT audit.audit_table('foo', true, true, '{id}'::text[]);
 audit_table 
-------------
 
(1 row)

--
-- Basic INSERT/UPDATE/DELETE
--
--- insert
INSERT INTO foo (a, b, c) VALUES (1, 2, 3) RETURNING id AS record_id \gset
SELECT row_data, changed_fields FROM audit.log ORDER BY id DESC LIMIT 1;
 row_data |      changed_fields      
----------+--------------------------
          | {"a": 1, "b": 2, "c": 3}
(1 row)

--- update
UPDATE foo SET b = 99 WHERE id = :record_id;
SELECT row_data, changed_fields FROM audit.log ORDER BY id DESC LIMIT 1;
         row_data         | changed_fields 
--------------------------+----------------
 {"a": 1, "b": 2, "c": 3} | {"b": 99}
(1 row)

--- delete
DELETE FROM foo WHERE id = :record_id;
SELECT row_data, changed_fields FROM audit.log ORDER BY id DESC LIMIT 1;
         row_data          | changed_fields 
---------------------------+----------------
 {"a": 1, "b": 99, "c": 3} | 
(1 row)

--
-- With table modifications
--
--- insert
INSERT INTO foo (a, b, c) VALUES (4, 5, 6) RETURNING id AS record_id \gset
SELECT row_data, changed_fields FROM audit.log ORDER BY id DESC LIMIT 1;
 row_data |      changed_fields      
----------+--------------------------
          | {"a": 4, "b": 5, "c": 6}
(1 row)

--- add column to table and update record
ALTER TABLE foo ADD COLUMN d INTEGER;
UPDATE foo SET d = 7 WHERE id = :record_id;
SELECT row_data, changed_fields FROM audit.log ORDER BY id DESC LIMIT 1;
              row_data               | changed_fields 
-------------------------------------+----------------
 {"a": 4, "b": 5, "c": 6, "d": null} | {"d": 7}
(1 row)

--- remove column from table and update record
ALTER TABLE foo DROP COLUMN d;
UPDATE foo SET c = 99 WHERE id = :record_id;
SELECT row_data, changed_fields FROM audit.log ORDER BY id DESC LIMIT 1;
         row_data         | changed_fields 
--------------------------+----------------
 {"a": 4, "b": 5, "c": 6} | {"c": 99}
(1 row)

--- delete
DELETE FROM foo WHERE id = :record_id;
SELECT row_data, changed_fields FROM audit.log ORDER BY id DESC LIMIT 1;
         row_data          | changed_fields 
---------------------------+----------------
 {"a": 4, "b": 5, "c": 99} | 
(1 row)

DROP TABLE foo;
DROP EXTENSION "pg-audit-json";
